{
  "id": "2c9be114-6d35-4408-adac-9ead35f51a27",
  "name": "Export deleted authority records job profile",
  "default" : true,
  "destination": "fileSystem",
  "description": "Export deleted authority records job profile",
  "userInfo": {
    "firstName": "System",
    "lastName": "Process",
    "userName": "system_process"
  },
  "mappingProfileId": "5d636597-a59d-4391-a270-4e79d5ba70e3",
  "metadata":{
    "createdDate":"2024-03-14T00:00:00Z",
    "createdByUserId":"00000000-0000-0000-0000-000000000000",
    "createdByUsername":"system_process",
    "updatedDate":"2024-03-14T00:00:00Z",
    "updatedByUserId":"00000000-0000-0000-0000-000000000000",
    "updatedByUsername":"system_process"
  }
}
